{
  "apiVersion": "anvilkit.io/contracts/v1",
  "kind": "ContractBom",
  "name": "platform-kernel",
  "version": "1.0.0",
  "digest": "sha256:1111111111111111111111111111111111111111111111111111111111111111",
  "createdAt": "2026-08-09T00:00:00.000Z",
  "issuer": "urn:anvilkit:issuer:contracts-release",
  "compatibility": {
    "minimumConsumerGeneration": 1,
    "maximumConsumerGeneration": 1
  },
  "components": [
    {
      "kind": "fixture-manifest",
      "name": "anvilkit.contract.fixture-manifest.v1",
      "version": "1.0.0",
      "mediaType": "application/vnd.anvilkit.contract-fixtures.v1+json",
      "digest": "sha256:2222222222222222222222222222222222222222222222222222222222222222",
      "size": 4096,
      "dependencies": [],
      "issuer": "urn:anvilkit:issuer:contracts-release",
      "provenanceDigest": "sha256:aaaaaaaaaaaaaaaaaaaaaaaaaaaaaaaaaaaaaaaaaaaaaaaaaaaaaaaaaaaaaaaa"
    },
    {
      "kind": "generator-set",
      "name": "anvilkit.contract.generator-set.v1",
      "version": "1.0.0",
      "mediaType": "application/vnd.anvilkit.contract-generator-set.v1+json",
      "digest": "sha256:3333333333333333333333333333333333333333333333333333333333333333",
      "size": 1024,
      "dependencies": [],
      "issuer": "urn:anvilkit:issuer:contracts-release",
      "provenanceDigest": "sha256:bbbbbbbbbbbbbbbbbbbbbbbbbbbbbbbbbbbbbbbbbbbbbbbbbbbbbbbbbbbbbbbb"
    },
    {
      "kind": "json-schema",
      "name": "anvilkit.contract.schema.agent-run.v1",
      "version": "1.0.0",
      "mediaType": "application/vnd.anvilkit.contract-schema.v1+json",
      "digest": "sha256:4444444444444444444444444444444444444444444444444444444444444444",
      "size": 8192,
      "dependencies": [
        {
          "kind": "registry-set",
          "name": "anvilkit.contract.registry-set.v1",
          "version": "1.0.0",
          "digest": "sha256:5555555555555555555555555555555555555555555555555555555555555555"
        }
      ],
      "issuer": "urn:anvilkit:issuer:contracts-release",
      "provenanceDigest": "sha256:cccccccccccccccccccccccccccccccccccccccccccccccccccccccccccccccc"
    },
    {
      "kind": "registry-set",
      "name": "anvilkit.contract.registry-set.v1",
      "version": "1.0.0",
      "mediaType": "application/vnd.anvilkit.contract-registry-set.v1+json",
      "digest": "sha256:5555555555555555555555555555555555555555555555555555555555555555",
      "size": 16384,
      "dependencies": [],
      "issuer": "urn:anvilkit:issuer:contracts-release",
      "provenanceDigest": "sha256:dddddddddddddddddddddddddddddddddddddddddddddddddddddddddddddddd"
    }
  ],
  "generatorSetDigest": "sha256:3333333333333333333333333333333333333333333333333333333333333333",
  "fixtureManifestDigest": "sha256:2222222222222222222222222222222222222222222222222222222222222222",
  "registrySetDigest": "sha256:5555555555555555555555555555555555555555555555555555555555555555",
  "releaseEvidenceDigest": "sha256:6666666666666666666666666666666666666666666666666666666666666666"
}
